,desc,prereqs,coreqs,name,units,department,profs,School Level,Course
0,This course number is used by the Office of International Education. Students should not register themselves for this course.,None,None,Study Abroad,,Architecture,Instructor TBA,Freshman,48-049
1,No course description provided.,None,None,Undergraduate Internship,3.0,Architecture,"Arscott, Mary-Lou",Senior,48-490
2,None,None,None,Independent Study,,Architecture,Instructor TBA,Graduate,48-599
3,None,None,None,Practicum,,Architecture,Instructor TBA,Graduate,48-700
4,"Thesis is a year-long, independently defined research and design project that takes the place of upper level option studios.  Thesis is an opportunity to develop skills, thoughts, and habits essential for future success, including mental discipline; independence of mind and judgment; working with advisors;  the capacity to focus and pursue a subject in depth and over an extended time;  the ability to design and execute a complex project; the skills of analysis, synthesis, and clear writing; and the self-confidence that grows from mastering a difficult challenge.  Thesis topics and research agendas are generated by the student, but must be determined in collaboration with an advising team, and approved by a Thesis Coordinator.  The School seeks to encourage an expansive range of rigorous and provocative inquiry as a culminating experience for the B.Arch education, including work that speculates, invents, or improves on existing ideas, practices, or systems through research and design; work that challenges the boundaries of the discipline and the profession, and moves beyond mere practice or solution-based work; worj that engages with open-ended and generalizable ideas, as much as with specific situations; work that projects or imagines a better future and an improved world;  work that leads to the new knowledge, ideas, understanding, or paradigms.  Acceptance into Thesis is dependent on passing the 48-497 ?Thesis Prep? course or its pre-approved equivalent, and submitting a rigorous thesis proposal to the Thesis Coordinator in late August, before the begin of classes.",None,None,Architecture Design Studio: Thesis II/ Independent Project,18.0,Architecture,"Gutschow, Kai",Graduate,48-519
5,Missing Course Description - please contact the teaching department.,None,None,Internship (MS & PhD),,Architecture,Instructor TBA,Graduate,48-704
6,"This is the preparatory course for the synthesis project course in the  Master of Science in Sustainable Design (MSSD) program. Students will build  upon the Research Models and Methods class to develop an individual project  proposal in an area of their interest related to sustainable design. The  students will attend bi-weekly meetings with the instructor and will submit  a formal research project proposal at the conclusion of the semester  including an abstract, a research plan, a schedule, an annotated  bibliography and proposed deliverables.  Prerequisites: Fall Coursework as per curriculum.",None,None,Sustainable Design Synthesis Prep,12.0,Architecture,Instructor TBA,Graduate,48-731
7,TBA,None,None,Master of Architecture,3.0,Architecture,"Gutschow, Kai",Graduate,48-695
8,"Sustainable Design Synthesis II This is the synthesis project course in the Master of Science in Sustainable Design (MSSD) program in the School of Architecture at Carnegie Mellon University. This course deals with synthesis in solving sustainable design problems using the tools, theories and methods studied in the prerequisite courses. Students will attend weekly meetings with the instructor, conduct the proposed research, submit a final written report and make a presentation of their project in a public forum. Nine-Month Program: Students will build upon the Research Models and Methods class to finalize an individual project proposal in an area of their interest related to sustainable design.  Prerequisites: 48-711, 48-722, 48-737, 48-752 or approved equivalents plus one selective.  Co-requisites: 48-723 or approved equivalent plus two selectives.  Twelve-Month Program: Students will complete the proposed project developed and approved in the Sustainable Design Synthesis I course. Prerequisites: 48-711, 48-722, 48-737, 48-752, 48-723, 48-795 or approved equivalents plus three selectives  Instructor: Stephen Lee  Units: 24 Units",None,None,Sustainable Design Synthesis,,Architecture,"Loftness, Vivian",Graduate,48-732
9,This course is for students to undertake a major project in which knowledge gained in the core courses is applied to problems relevant to the field of architecture. Course must be taken under the advice of a faculty member teaching in the MSc-Ph.D. Programs. Master of Science Students who perform satisfactorily in the Graduate Research Seminar course are permitted to take the Masters project course. Prerequisite: completion of all core requirements and consent of the instructors of 48-790 and 48-791.,None,None,M.S. Project,,Architecture,"Krishnamurti, Ramesh",Graduate,48-791
10,This course is for Ph.D. students who have successfully completed their qualifying exams and are working on their dissertation work.     Instructo(s):  Units: 36,None,None,Ph.D. Thesis,,Architecture,Instructor TBA,Graduate,48-793
11,None,None,None,Graduate Reading and Research,,Architecture,Instructor TBA,Graduate,48-794
12,"This course is for students who wish to pursue work independent of all other courses offered, but consistent with the direction of the Ph.D. Programs.     Prerequisites: Written proposal for work by a faculty member teaching in the Ph.D. Program, and his/her agreement to advise the student. Both student and faculty must be in residence.      Instructor(s):  Units: 36",None,None,Ph.D. Independent Study,,Architecture,"Krishnamurti, Ramesh",Graduate,48-792
13,"A tutorial studio in which an Art student works individually on a self-generated project under the supervision of a School of Art faculty member.  Prior to enrolling in Independent Study, the student must complete an Independent Study Proposal form (available in the bins on the 3rd floor of CFA) which is signed by the faculty member and the Assistant Head of Academic Affairs of the School of Art. Prerequisite: Art Junior/Senior status and by instructor permission.",None,None,Studio Independent Study,,Art,"Bingham, Robert",Senior,60-499
14,"Art Internships are open to all BFA, BHA, BSA and BCSA Art students. Internships may take place with appropriate individuals or organizations within or outside of Carnegie Mellon University. The requirements for an internship are in the School of Art Handbook (available at the School of Art website). Prior to being enrolled for an internship, students must complete an Internship Proposal Form, which defines the goals of the internship. This form must be signed by their site supervisor and approved by the Assistant Head of the School of Art. Forms are available in the bins on the 3rd floor of CFA.  Junior and Senior Art majors only.",None,None,Internship,,Art,"Cato, Mark",Graduate,60-590
15,"The BXA Undergraduate Research Project is for students who want to work on a self-designed project with the one-to-one guidance of a faculty advisor. The project should be interdisciplinary in nature, and can be a scholarly and/or creative endeavor. The project may take the form of a written thesis, a compilation of creative works, an outreach project, etc. The project topic must be pre-approved by the faculty member who agrees to supervise the project and assign a letter grade for the course. Projects are to be completed in one semester, may be worth 3, 6, 9, or 12 units of academic credit, and cannot be taken concurrently with the BXA Capstone Project during the senior year. To register, students must submit an Undergraduate Research Project Proposal Form signed by both the student and the faculty advisor, along with a proposal, to their BXA academic advisor.",None,None,BXA Undergraduate Research Project,,BXA Intercollege Degree Programs,"Murray, M. Stephanie",Junior,52-390
16,"An internship is a supervised professional work experience with clear links to a students academic goals. BXA students may choose to complete a BXA Internship for elective credit with appropriate individuals or organizations within or outside of Carnegie Mellon University. Junior and senior BXA students in good academic standing are eligible to receive academic credit for one internship. Grading is pass/no pass only. Prior to enrolling in an internship, the student must have a BXA Internship Agreement Form signed by their site supervisor and approved by their BXA academic advisor.",None,None,BXA Internship,,BXA Intercollege Degree Programs,"Murray, M. Stephanie",Graduate,52-590
17,"This course will focus on the genetics, cell biology, and developmental biology behind human biology and human disease, as well as the growing opportunities for novel therapeutic options that basic science delivers.  This is a topics based course, with topics chosen to cover aspects of human biology and health that students are likely to encounter in their daily lives such as cancer, stem cells, genome sequencing, and the human microbiota. Students will explore these topics from both a basic science and a human health perspective.",None,None,Basic Science to Modern Medicine,9.0,Biological Sciences,"Mccartney, Brooke",Freshman,03-132
18,"Research projects for sophomores under the direction of a regular or adjunct BME faculty member.  Arrangements may also be made via the Associate Head of BME for off-campus projects provided that a regular or adjunct BME faculty member agrees to serve as a co-advisor.  The nature of the project, the number of units, and the criteria for grading are to be determined between the student and the research advisor.  The agreement should be summarized in a two-page project description with sign-off by the research advisor and a copy submitted for review and filing with the BME Department.  A final written report of the results is required.  Units may vary from 9 to 12 according to the expected time commitment, with one unit corresponding to 1 hour of research per week.  One (but not more than one) semester of research, if registered for at least 9 units, may be counted as a restricted elective course toward the BME additional major.",None,None,Sophomore BME Research Project,,Biomedical Engineering,"Zapanta, Conrad",Sophomore,42-200
19,"Students will read papers from the original literature under the direction of a faculty member. Students will be required to demonstrate mastery of the readings by discussions with the sponsoring faculty member, oral presentations, or writing of one or more papers summarizing and extending the information in the readings. If appropriate, students may write a program(s) to satisfy this last requirement. A student may take this course only once.  This is a mini format course.  Special permission required.",None,None,Independent Study,,Biological Sciences,"Campanaro, Becki",Sophomore,03-210
20,"Research projects for sophomores under the direction of a regular or adjunct BME faculty member.  Arrangements may also be made via the Associate Head of BME for off-campus projects provided that a regular or adjunct BME faculty member agrees to serve as a co-advisor.  The nature of the project, the number of units, and the criteria for grading are to be determined between the student and the research advisor.  The agreement should be summarized in a two-page project description with sign-off by the research advisor and a copy submitted for review and filing with the BME Department.  A final written report of the results is required.  Units may vary from 9 to 12 according to the expected time commitment, with one unit corresponding to 1 hour of research per week.  One (but not more than one) semester of research, if registered for at least 9 units, may be counted as a restricted elective course toward the BME additional major.",None,None,Junior BME Research Project,,Biomedical Engineering,"Zapanta, Conrad",Junior,42-300
21,Students may investigate research problems under the supervision of members of the faculty. Permission of a faculty advisor required.,None,None,Undergraduate Research,,Biological Sciences,"Campanaro, Becki",Senior,03-445
22,A student enrolled in this course conducts an independent investigation on a project in a faculty advisors lab. The project is selected from a major area of research study with the advice and approval of the faculty advisor. This course is required of students who are enrolled in the Master of Science program and wish to write and defend a thesis.,None,None,MS Thesis Research,,Biological Sciences,"Brasier, Daniel",Graduate,03-700
23,Doctoral Thesis Research consists of an independent investigation on a project selected from a major area of research study with the advice and approval of the faculty advisor.,None,None,Doctoral Thesis Research,,Biological Sciences,"Hinman, Veronica",Graduate,03-900
24,"Research projects for sophomores under the direction of a regular or adjunct BME faculty member.  Arrangements may also be made via the Associate Head of BME for off-campus projects provided that a regular or adjunct BME faculty member agrees to serve as a co-advisor.  The nature of the project, the number of units, and the criteria for grading are to be determined between the student and the research advisor.  The agreement should be summarized in a two-page project description with sign-off by the research advisor and a copy submitted for review and filing with the BME Department.  A final written report of the results is required.  Units may vary from 9 to 12 according to the expected time commitment, with one unit corresponding to 1 hour of research per week.  One (but not more than one) semester of research, if registered for at least 9 units, may be counted as a restricted elective course toward the BME additional major.",None,None,Senior BME Research Project,,Biomedical Engineering,"Zapanta, Conrad",Senior,42-400
25,This course is intended for directed study only with permission of the Associate Department Head.,None,None,Directed Study,,Biomedical Engineering,"Cook, Keith",Graduate,42-799
26,"Students will work with a faculty member, local biomedically-oriented company or local clinical researcher on a technical research, development or outreach project.  A faculty member affiliated with the Department of Biomedical Engineering will either serve as the advisor for an internal project or as a liaison for an external industrial/clinical project.  The project will culminate in an oral presentation and an internally-archived written report which documents the project and its results.  The presentation and report will be reviewed by the faculty advisor/liaison; this review will serve as the basis for the assignment of the course grade. Pre-requisite:  Graduate standing and consent of faculty advisor/liaison.  Variable units.",None,None,Practicum in Biomedical Engineering,12.0,Biomedical Engineering,"Trumble, Dennis",Graduate,42-790
27,None,None,None,M.S. Research Final Report,0.0,Biomedical Engineering,"Cook, Keith",Graduate,42-899
28,"This course may be taken by M.S. or Ph.D. students as part of the arrangement to work in an outside organization during the summer, for the purpose of gaining experience in the real-world practice of biomedical engineering. Students should register for Section A during the academic year and Section R during the summer. Pre-requisite:Graduate standing, require special arrangement through the advisor and approval of the department, and approval of the Office of International Education for foreign students. [Top]",None,None,Extramural Practicum,,Biomedical Engineering,"Cook, Keith",Graduate,42-792
29,MS Research,None,None,M.S. Research,,Biomedical Engineering,"Cook, Keith",Graduate,42-890
30,This course is designed to give students enrolled in the Ph.D. program an opportunity to conduct extensive research over the course of their studies culminating in a Ph.D. thesis.  Variable units.,None,None,Ph.D. Thesis Research,,Biomedical Engineering,"Cook, Keith",Graduate,42-990
31,"42-997  PhD Qualifying Examination  Fall and Spring    A qualifying examination is given to determine the students general knowledge of the fields of engineering appropriate to the individuals program, and to assess the students ability to use this knowledge in the solution of problems and in the execution of original research. The examination comprises written and/or oral parts. The student will be considered to have passed the qualifying examination when he or she has successfully completed all of the required parts. A candidate must take the qualifying examination at the time specified by the department, generally within the first three semesters of study. Upon satisfactorily passing the examination, the student will be accepted as a candidate for the degree of Doctor of Philosophy. If the student has not already received a Masters Degree, upon application and provided that all other requirements have been met, he or she may be granted the degree of Master of Science at the next commencement.    Passing the Ph.D. qualifying examination admits a student to candidacy for the Ph.D. degree for a period of no longer than six calendar years. If, at the end of this six-year period, the Ph.D. has not been awarded, the student must reapply for admission to the graduate program and will be judged competitively with other students applying at the same time. If the student is re-admitted, he or she may, at the discretion of the department, be requested to pass the qualifying examination again before the Ph.D. is awarded. A student may petition for extension of the six-year limit under extenuating circumstances such as a forced change of advisor, military service, or prolonged illness. Note that the time limits on the duration of Ph.D. candidacy outlined here are more restrictive than those of the general university policy.",None,None,Ph.D. Qualifying Examination,0.0,Biomedical Engineering,"Cook, Keith",Graduate,42-997
32,"This course allows a student to gain computational biology experience in a real-world setting. Internships vary widely in scope, but common to all is the chance to practice computational biology skills acquired in the classroom. Typically, students seek and secure their own internships.",None,None,Computational Biology Internship,,Biological Sciences,"Brasier, Daniel",Graduate,03-601
33,PhD Thesis Prospectus.,None,None,Ph.D. Proposal,0.0,Biomedical Engineering,"Cook, Keith",Graduate,42-998
34,"This class focuses on the statistical analysis of the relationship between two or more random variables. In particular, we examine the estimation of the conditional mean of the dependent variable as a function of independent variables using linear regression. We draw on statistical theory to determine the precision of our estimates and to conduct inference about the population, and we examine a number of applications to business, finance, and economics throughout the course.",(21-112 or 21-120) and (36-200 or 36-201 or 36-220 or 36-207 or 36-247 or 70-207) and (73-100 or 73-102),None,Regression Analysis,9.0,Business Administration,"Yang, I Ta",Sophomore,70-208
35,Biomedical Engineering PhD Thesis Defense Examination,None,None,Ph.D Thesis Defense,0.0,Biomedical Engineering,"Cook, Keith",Graduate,42-999
36,"This course provides a mathematical foundation for the application of optimization techniques to business problems, as well as the practical implementation of these methods. Mathematical optimization techniques have been applied for decades in the context of logistics, supply chain management, and strategic planning, with great success. In recent years, the application of mathematical optimization has penetrated, and in some cases (re-)defined, many other areas such as the (financial) service industry, analytical marketing, health care, and web-based businesses. In this course, the most important methods and techniques underlying mathematical optimization are studied. These include linear programming, integer programming, and nonlinear programming as basic mathematical methodologies. Based on these, we also consider methodologies for particular problem classes such as network models and traveling salesman problems. During the course we will emphasize mathematical modeling, that is, creating a mathematical description that reflects a given practical problem described in words. Motivated by these mathematical models, we then discuss the necessary mathematical techniques for finding optimal solutions. Lastly, we consider the solution of these problems using optimization software, i.e., we represent the mathematical models in Excel and use Excel Solver to compute an optimal solution.",21-256 or 21-259,None,Optimization for Business,9.0,Business Administration,"Haddadan, Arash",Sophomore,70-257
37,"This course provides the knowledge and skills necessary for the student to understand financial statements and financial records and to make use of the information for management and investment decisions. Topics include: an overview of financial statements and business decisions; the balance sheet, the income statement, and the cash flow statement; sales revenue, receivables, and cash; cost of goods sold and inventory; long-lived assets and depreciation, and amortization; current and long-term liabilities; owners equity; investments in other corporations; an introduction to financial statement analysis and international issues dealing with financial statements.",None,None,Introduction to Accounting,9.0,Business Administration,"Wu, Sang",Freshman,70-122
38,"Firms create value by making good investment decisions. Finance is the field of management science tasked with making this happen. It is a set of tools with which firms identify good investments and decide how to pay for them. Paying for them ultimately involves getting money from households. Therefore, finance also describes the investment decisions of households and the resulting allocation of the economys resources across firms and time. This course is the introductory finance course in the undergraduate business program. The main topics covered in the course are Financial Markets, Net Present Value, The Objective of the Firm, Discounted Cash Flow, Portfolio Theory and the Cost of Capital, The Efficient Markets Hypothesis, The Capital Structure of the Firm, and Business Valuation. Time permitting, the course will also provide an introduction to option markets and derivative securities. Upon completing the course a student will be able to consider a large and complex business problem, make some assumptions, structure the firms cash flows in a spreadsheet, calculate the value of different solutions to the problem, and make a decision.",(73-102 or 73-100) and (36-200 or 36-201 or 36-217 or 36-225 or 36-207 or 70-207),None,Finance,9.0,Business Administration,"Yang, Tianyi",Junior,70-391
39,None,None,None,CIT Internship,0.0,CIT Interdisciplinary,Instructor TBA,Freshman,39-120
40,Students doing a business-related internship for academic credit may enroll in this course for three units with a pass/no pass grade. Students must submit an internship agreement form to the instructor for approval prior to the start of the internship. A summary writing assignment must be submitted after the internship in order to receive credit. Business majors may enroll directly; non-business majors may enroll with special permission.,None,None,Internship,3.0,Business Administration,"Hollifield, George Burton",Senior,70-499
41,"The college of engineering at Carnegie Mellon considers experiential learning opportunities important educational options for its undergraduate students. One such option is cooperative education, which provides a student with an extended period of exposure with a company. Therefore projects can be of significant depth in experience. To participate, students must complete a CIT Co-op Approval form (located in Scaife Hall 110) and submit for approval. Students must possess at least junior status and have an overall grade point average of 3.0 or above. All co-ops must be approximately 8 months in uninterrupted length. If the co-op is approved, the CIT Undergraduate Studies Office will add the course to the students schedule, and the student will be assessed tuition for 0-3 units. Upon completion of the co-op experience, students must submit a 1-2 page report of their work experience, and a 1-2 page evaluation from the company supervisor to the CIT Undergraduate Office. If the reports are approved, a P grade will be assigned. International students should also be authorized by the Office ofInternational Education (OIE). More information regarding CPT is available on OIEs website.",None,None,CIT Co-Op,,CIT Interdisciplinary,Instructor TBA,Junior,39-390
42,"Juniors who have an accumulated QPA of at least 3.5 receive an invitation to participate in the program.       This course, open by invitation only, will provide the opportunity for close interaction with a faculty member through independent honors research in a number of disciplinary and interdisciplinary areas, as part of the CIT Honors Research Program. Students will work on their projects during their senior year, earning the equivalent of 18-24 units. Students are required to register for CIT Honor Research Project 39-500. To receive CIT College Honors, a student must complete at least 18 units in 39-500 on the same research topic. Students are also required to participate in the CIT poster competition at the Undergraduate Research Symposium, Meeting of the Minds, a university-wide celebration of undergraduate research.",None,None,CIT Honors Research Project,,CIT Interdisciplinary,"Larsen, Kurt",Graduate,39-500
