,desc,prereqs,coreqs,name,units,department,profs,School Level,Course
200,"The Mellon College of Science at Carnegie Mellon considers experiential learning opportunities important educational options for its undergraduate students. One such option is an internship, normally completed during the summer. Students do not need to officially register for an internship unless they want it listed on their official transcripts. The MCS Undergraduate Deans Office will add the course to the students schedule, and the student will be assessed tuition for 3 units. Upon completion of the internship, students must submit a 1-2 page report of their work experience, and a 1-2 page evaluation from the academic or company supervisor to the Undergraduate Deans Office in DH 1324. After the reports have been reviewed and approved, a P grade will be assigned.",None,None,MCS Summer Internship,,MCS Interdisciplinary,"Braun, Maggie",Freshman,38-052
201,"Vectors, lines, planes, quadratic surfaces, polar, cylindrical and spherical coordinates, partial derivatives, directional derivatives, gradient, divergence, curl, chain rule, maximum-minimum problems, multiple integrals, parametric surfaces and curves, line integrals, surface integrals, Green-Gauss theorems. 3 hrs. lec., 1 hr. rec.",21-122,None,Calculus in Three Dimensions,9.0,Mathematical Sciences,"Howell, Jason",Sophomore,21-259
202,"A first course in linear algebra intended for scientists, engineers, mathematicians and computer scientists.  Students will be required to write some straightforward proofs.  Topics to be covered: complex numbers, real and complex vectors and matrices, rowspace and columnspace of a matrix, rank and nullity, solving linear systems by row reduction of a matrix, inverse matrices and determinants, change of basis, linear transformations, inner product of vectors, orthonormal bases and the Gram-Schmidt process, eigenvectors and eigenvalues, diagonalization of a matrix, symmetric and orthogonal matrices. 21-127 is strongly recommended. 3 hrs. lec., 1 hr. rec",None,None,Matrices and Linear Transformations,10.0,Mathematical Sciences,"Howell, Jason",Sophomore,21-241
203,"Integration by trigonometric substitution and partial fractions; arclength; improper integrals; Simpsons and Trapezoidal Rules for numerical integration; separable differential equations, Newtons method, Eulers method, Taylors Theorem including a discussion of the remainder, sequences, series, power series. Parametric curves, polar coordinates, vectors, dot product. 3 hrs lec., 2 hrs. rec.",21-112 or 21-120,None,Integration and Approximation,10.0,Mathematical Sciences,"Handron, David",Freshman,21-122
204,"This course introduces the basic concepts, ideas and tools involved in doing mathematics. As such, its main focus is on presenting informal logic, and the methods of mathematical proof. These subjects are closely related to the application of mathematics in many areas, particularly computer science. Topics discussed include a basic introduction to elementary number theory, induction, the algebra of sets, relations, equivalence relations, congruences, partitions, and functions, including injections, surjections, and bijections.  A basic introduction to the real numbers, rational and irrational numbers.  Supremum and infimum of a set.  3 hrs. lec., 2 hrs. rec.",None,None,Concepts of Mathematics,10.0,Mathematical Sciences,"Gheorghiciuc, Irina",Freshman,21-127
205,"Students in this course gain experience with the application of mathematical models to business and/or industrial problems during an internship.  The internship is set up by the student in consultation with a faculty member.  The students must also have a mentor at the firm providing the internship, who together with the faculty member develops a description of the goals of the internship.  The internship must include the opportunity to learn about problems which have mathematical content.",None,None,Practicum,,Mathematical Sciences,"Howell, Jason",Graduate,21-590
206,This course affords undergraduates to pursue elementary research topics in the area of expertise of the instructor.  The prerequisites will depend on the content of the course.,None,None,Mathematical Modeling,9.0,Mathematical Sciences,"Hagerty, Adrian",Senior,21-499
207,None,None,None,Reading and Research,,Mathematical Sciences,"Hrusa, William",Graduate,21-900
208,"The Department of Mechanical Engineering at Carnegie Mellon considers experiential learning opportunities important educational options for its undergraduate students. One such option is an internship, normally completed during the summer. Students do not need to officially register for an internship unless they want it listed on their official transcripts. The Mechanical Engineering Department will add the course to the students schedule, and the student will be assessed tuition for 3 units. Upon completion of the internship, students must submit a 1-2 page report of their work experience, and a 1-2 page evaluation from the company supervisor to the Academic Advisors Office. After the reports have been reviewed and approved, a P grade will be assigned. This process should be used by international students interested in Curricular Practical Training (CPT) International students should also be authorized by the Office of International Education (OIE). More information regarding CPT is available on OIEs website.",None,None,Internship in Mechanical Engineering,3.0,Mechanical Engineering,"Hertz, Chris",Freshman,24-052
209,None,None,None,Practicum in Mathematical Sciences,,Mathematical Sciences,"Hrusa, William",Graduate,21-785
210,Individual reading courses or projects in mathematics and its applications. Prerequisites and units to be negotiated with individual instructors.,None,None,Undergraduate Reading and Research,,Mathematical Sciences,Instructor TBA,Graduate,21-599
211,"The Department of Mechanical Engineering at Carnegie Mellon considers practical learning opportunities important educational options for its undergraduate students.  One such option is cooperative education, which provides a student with an extended work experience with a company or government institution.    To participate, students must possess at least junior status and have an overall grade point average of 3.0 or above.  Students must complete a Co-Op Approval Form and submit it for approval.  If the application is approved, the course will be added to the students schedule and the student will be assessed tuition for 0 units for each semester that the student participates. All co-ops must be approximately 5-8 months in uninterrupted length. Upon completion of the co-op experience, students must submit a 1-2 page report of their work experience, and a 1-2 page evaluation from the company supervisor to the ME Undergraduate Education Committee.  If the reports are approved, a P grade will be assigned.  International students should contact their academic advisor for additional information.   Prerequisite:  Special permission required",None,None,Mechanical Engineering Co-op,,Mechanical Engineering,"Hertz, Chris",Junior,24-390
212,"Ordinary differential equations: first and second order equations, applications, Laplace transforms; partial differential equations: partial derivatives, separation of variables, Fourier series; systems of ordinary differential equations; applications. 21-259 or 21-268 or 21-269 are recommended. 3 hrs. lec., 1 hr. rec.",21-122,None,Differential Equations,9.0,Mathematical Sciences,"Handron, David",Sophomore,21-260
213,"A major part of the course concentrates on algebraic methods, which are relevant in the study of error correcting codes, and other areas. Topics covered in depth include permutations and combinations, generating functions, recurrence relations, the principle of inclusion and exclusion, and the Fibonacci sequence and the harmonic series. Additional topics may include existence proofs, partitions, finite calculus, generating combinatorial objects, Polya theory, codes, probabilistic methods. 3 hrs. lec",(21-122) and (21-228 or 15-251),None,Combinatorics,9.0,Mathematical Sciences,"Gheorghiciuc, Irina",Junior,21-301
214,This independent study is designed to give students an opportunity to explore pertinent subjects through faculty directed reading. Variable hrs.   Prerequisite: Completion of Supervised Reading form acquired by your graduate MechE advisor; which includes permission of the instructor.,None,None,Supervised Reading,,Mechanical Engineering,"Hertz, Chris",Graduate,24-793
215,"This course is designed to give students increased exposure to open-ended problems and research type projects. It involves doing a project on a research or design topic and writing a thesis describing that project. The project would be conducted under the supervision of a mechanical engineering faculty member (the advisor), and must be approved by the advisor before inception. This course can be taken at any time after the Junior year and before graduation which includes the summer after the Junior year. Completion of 18 units of this course with a grade of B or better is a partial fulfillment of the requirements for Departmental Research Honors.",None,None,Department Research Honors,,Mechanical Engineering,"Hertz, Chris",Senior,24-492
216,"Practice in the organization, planning, and execution of appropriate engineering projects. These investigations may be assigned on an individual or a team basis and in most cases will involve experimental work.  9 hrs. lab.",None,None,Mechanical Engineering Project,,Mechanical Engineering,"Hertz, Chris",Junior,24-392
217,"Practice in the organization, planning, and execution of appropriate engineering projects. These investigations may be assigned on an individual or a team basis and in most cases will involve experimental work.  9 hrs. lab.",None,None,Mechanical Engineering Project,,Mechanical Engineering,"Hertz, Chris",Junior,24-391
218,"This course is designed to give students increased exposure to open-ended problems and research type projects. It involves doing a project on a research or design topic and writing a thesis describing that project. The project would be conducted under the supervision of a mechanical engineering faculty member (the advisor), and must be approved by the advisor before inception. This course can be taken at any time after the Junior year and before graduation which includes the summer after the Junior year. Completion of 18 units of this course with a grade of B or better is a partial fulfillment of the requirements for Departmental Research Honors.",None,None,Department Research Honors,,Mechanical Engineering,"Hertz, Chris",Senior,24-491
219,None,None,None,Doctoral Thesis Research,,Mathematical Sciences,"Shreve, Steven",Graduate,21-902
220,No course description provided.,None,None,Graduate Reading and Research,,Mechanical Engineering,"Hertz, Chris",Graduate,24-796
221,"This course is designed to be a training opportunity in engineering research and associated professional activity. Content includes a series of investigations under the students initiative culminating in comprehensive reports, with special emphasis on orderly presentation and effective English composition for Master of Science candidates. Variable hrs.    Prerequisite: permission of the instructor.",None,None,Master of Science Project,,Mechanical Engineering,"Hertz, Chris",Graduate,24-794
222,"The Department of Mechanical Engineering at Carnegie Mellon considers experiential learning opportunities important educational options for its graduate students. One such option is an internship, normally completed during the summer. If a student receives an internship, the Mechanical Engineering Department will add the internship course to the students schedule, and the student will be assessed tuition for 3 units. Upon completion of the internship, students must submit a 2-3 page report with supervisor signature detailing the work experience and including how the internship was related to Mechanical Engineering. After the report has been reviewed and approved, a letter grade will be assigned and these 3 units will count towards degree requirements. International students interested in registering for the practicum must also be authorized for Curricular Practical Training (CPT).  Further information is available on the Office of International Education?s website: www.cmu.edu/oie.",None,None,Practicum in Mechanical Engineering,,Mechanical Engineering,"Hertz, Chris",Graduate,24-799
223,tba,None,None,Organizational Ethics,4.0,Medical Management:Sch of Pub Pol & Mgt,"Apple, Rebekah",Graduate,92-848
224,"Elementary Spanish Online I is for beginning students, emphasizing the development of communicative language and cultural competence. Students will work towards improving their writing, reading, listening and speaking abilities in Spanish, such that they become comfortable working with a variety of topics from Spanish-speaking cultural areas. Students will develop basic interactional and routine public communication patterns. This course is designed for students with no previous knowledge of Spanish and who need a more flexible approach to language learning than that offered in a standard classroom course. All materials are Web-based, with extensive use of Internet technologies for research, writing, and communication. During regular semesters, this course is offered in a hybrid mode requiring one 80-minute class per week in addition to weekly 20-minute individual meetings with the instructor or a peer speaking assistant. There is a materials fee for taking this course which is paid by credit card on first log-in to the course website. A student with prior experience in Spanish must take the placement exam.",None,None,Elementary Spanish I Online,12.0,Modern Languages,"Tardio, Therese",Freshman,82-143
225,N/A,None,None,Business Plan Development,4.0,Medical Management:Sch of Pub Pol & Mgt,"Zak, Timothy",Graduate,92-898
226,"This course is for students with no prior experience in French. Using a proficiency-oriented approach, students will develop contextually appropriate interpersonal communication skills in both written and spoken French, develop reading and listening skills through the use of various media, understand fundamental grammar, acquire vocabulary, and gain a basic understanding of French and francophone cultures through class activities. Regular homework, quizzes, tests, presentations, and class participation are mandatory (four in-class hours per week). The elementary level is also designed to help students learn to reflect and draw upon strategies used by good language learners in their second language study. A student with prior experience in French must take the placement exam.",None,None,Elementary French I,12.0,Modern Languages,"Van Compernolle, Remi",Freshman,82-101
227,"This course introduces learners to Modern Standard Arabic (MSA) in its written and spoken forms to achieve communicative competence at the elementary level in all language skills (listening, speaking, reading, and writing). To this end the course follows a proficiency-oriented approach to language teaching. In addition to MSA, the course introduces students to one of the popular spoken dialects in the Arab world such as Egyptian, Levantine, or Moroccan (depending upon the instructors background/expertise). Students will also study various cultural aspects of the Arab world through written, audio-visual and online-based materials.  Students with prior knowledge of Arabic must take the placement exam.",None,None,Elementary Arabic I,12.0,Modern Languages,"Al Masaeed, Khaled",Freshman,82-111
228,"This course is the first part of a two-semester course sequence (82-171, 82-172) for students with no prior experience in Japanese. It emphasizes the development of communicative language proficiency through oral practice, aural comprehension, reading, writing, and the study of cultural aspects of Japanese society. Regular homework, quizzes, tests, presentations, and class participation are mandatory (four in-class hours per week). The elementary level is also designed to help students learn to reflect and draw upon strategies used by good language learners in their second language study. A student with prior experience in Japanese must take the placement exam.",None,None,Elementary Japanese I,12.0,Modern Languages,"Scheide, Angel",Freshman,82-171
229,"Chinese calligraphy is a crucial part of Chinese culture and world art. It is also a clear manifestation of Chinese philosophy that has influenced Chinese people for several thousand years. This introductory course on Chinese calligraphy provides students with basic knowledge of Chinese calligraphy and how it mirrors Chinese history, culture, and philosophy. It will also introduce the fundamental characteristics of the Chinese writing system, its cultural content, and principles of formation as well as the skills used in Chinese calligraphy. At the end of the course, students will have a good understanding of Chinese characters and their cultural and philosophical background but also be able to appreciate the art and beauty in Chinese calligraphy. Classes include lectures, movies, discussions, hands-on practice, and projects. Field trips and guest speakers may also be arranged if opportunities should arise.  Prerequisite: None",None,None,Chinese Calligraphy: Culture and Skills,9.0,Modern Languages,"Yao, Tianxue",Freshman,82-137
230,"This course brings linguistic and cultural diversity in the Arab world to the forefront through exposing students to the key social issues in the study of multilingualism. To this end, the course will explore and analyze some of the deeply held language ideologies in Arab and international contexts. Topics to be covered in the course include (but are not limited to) multilingualism within and across languages (e.g., multidialectal practices, code-switching between languages, language variation and change), societal and individual multilingualism (e.g. language and identity), multilingualism in institutional sites (e.g. schools, the work place), language policy and planning, and language rights.  The course is taught in a seminar, discussion-based format and students will construct projects to explore course topics in a hands-on manner. The course is taught in English and students who wish to take the course as a Modern Languages major or minor elective will need to complete their final project on a topic relevant to the language they study.",None,None,Multilingualism and Multiculturalism in the Arab World,9.0,Modern Languages,"Al Masaeed, Khaled",Sophomore,82-217
231,"82-286-W  The French in the Middle East: We will work to uncover the genesis of cultural stereotypes that the French have of people from the Arab world, and vice versa, and trace stereotypes historically to their modern forms. Our questions are: What happens when cultures mix? What are sources of stereotypes? Do they hinder modern social and political relationships? What is Frances current relationship with countries in the Middle East? How do people from the Arab world-view France and the French?  82-286-X Political and Social Institutions - Islam in France: How do political and social institutions respond to changes that are the result of newer populations to established nations? By 2057, France will house the largest population of Muslims in Western Europe and Islam may become the majority religion in France. 43 of the French do not currently believe that Islam is compatible with French society and face ongoing tensions that seemingly jeopardize the fabric of the Republics  ideologies.",None,None,Understanding Cultural Complexities,9.0,Modern Languages,"Youngs, Bonnie",Sophomore,82-286
232,TBA,None,None,Internship,,Music,"Johnston, Sharon",Graduate,57-590
233,"This course surveys the development and contexts of European art music and its global adaptation. While keeping in view the chronology from Gregorian chant to the present, this survey emphasizes key personalities and issues, particularly issues relating to period style and interpretive decisions in performance.",None,57-188,Survey of Western Music History,9.0,Music,"Johnston, Paul",Freshman,57-173
234,"This course is the first part of a two-semester course sequence (82-271, 82-272). At the intermediate level, students will continue to improve the basic skills of listening, speaking, reading and writing skills with the goal of becoming more proficient in daily communication needs, and takes an integrated approach to the study of Japanese language and culture, consisting of grammar review, reading, and intensive practice in written and spoken Japanese. Course materials include authentic audiovisual and written texts in addition to the assigned textbooks. Also integrated are cultural explorations through direct interactions with native speakers. Regular homework, quizzes, tests, presentations, essays, and class participation are mandatory (four in-class hours per week). A student with prior experience in Japanese must take the placement exam.",82-172,None,Intermediate Japanese I,12.0,Modern Languages,"Yasuhara, Yoshihiro",Sophomore,82-271
235,This practicum is offered to improve the performance skills of performance majors by providing them orchestral or vocal performance experience in a professional ensemble.  Practical experience is essential for the career development of the professional musician.,None,None,Practicum,,Music,"Johnston, Sharon",Graduate,57-690
236,"This course is the required co-requisite listening component for Survey of Western Music History (57-173).  In this course, students listen critically to essential music which has stood the test of time and to superior performances.  It features 2-3 hours of listening per week.",None,57-173,Repertoire and Listening for Musicians,1.0,Music,"Johnston, Paul",Freshman,57-188
237,"This course is designed for students who have completed four semesters of Russian at Carnegie Mellon or for those who have equivalent Russian skills as demonstrated via placement exam. The course focuses on further development of the linguistic and stylistic practices of advanced students based on cultural analysis of Russian literature. Focus is on rapid vocabulary expansion as well as correction of high frequency syntax errors that persist beyond the intermediate level. Written compositions and translations, assigned for homework, are required for the development of grammatical accuracy and stylistic appropriateness. All class discussions are conducted in Russian. A student with prior experience in Russian must take the placement exam.",None,None,Special Topics: Russian in Context,9.0,Modern Languages,"Kats, Naum",Junior,82-399
238,"This course deals with common-practice harmony. It includes triads and their inversions, tonality and modality, non-harmonic tones, cadences, and the basic concepts of modulation.  Section assignment is determined by a placement test.  It includes work on fundamentals for inexperienced students.",None,None,Basic Harmony I,9.0,Music,"Domencic, Mark",Freshman,57-149
239,TBD,None,None,Graduate Reading and Research,5.0,Music,"Johnston, Sharon",Graduate,57-972
240,"As human beings, we frequently grapple with difficult moral questions. How ought I treat my friends and peers? What kinds of policies should a government adopt? When, if ever, can we justify harm? These are the kinds of questions we will consider as we survey some ethical theories from across the globe and across time. Along the way, we will consider the implications of those theories for real world ethical issues of today.",None,None,Introduction to Ethics,9.0,Philosophy,"Broxham, Mason",Freshman,80-130
241,"In this introductory course we will explore three major areas of Philosophy: Ethics, Metaphysics, and Epistemology. Accordingly the course is divided into three sections. In each section we will read primary sources and discuss some of the main philosophic problems associated with that area. These will include: moral problems (Ethics), problems rising from the debates about free-will, personal identity or intelligence (Metaphysics), and inquiries about the scope and limits of human knowledge (Epistemology). We will then introduce some theories designed to solve such problems, and try to understand the strengths and weaknesses of these theories. We will apply different techniques and theories to issues that we might encounter in the real world. We will use class discussions, homeworks and papers to learn skills for evaluating arguments. These skills include: how to present a philosophic argument, what are the assumptions that justify it, what are its weaknesses and its strengths, whether such weaknesses can be resolved and, if they cannot be resolved, why.",None,None,Introduction to Philosophy,9.0,Philosophy,"Millar, Adam",Freshman,80-100
242,Directed Reading,None,None,Directed Reading,,Philosophy,"Zollman, Kevin",Graduate,80-990
243,"While many interesting questions about religion are belief-specific, we will strive in this course to keep a global perspective. We will begin by considering a concept at the center of Western religion -- God -- as it presents itself in various traditions. We will then move to consider major Eastern religions, with a focus on their influence on philosophical thought. In both of these studies, we will emphasize the relationship between language and religion. We will conclude the course by considering commonalities between Eastern and Western religious thought. The student should leave the course with 1) the tools to consider religious text and rhetoric philosophically, and 2) a sharpened idea of what religion is (though this might differ from my own).",None,None,Philosophy of Religion,9.0,Philosophy,"Walker, Alec",Sophomore,80-276
244,Independent Study,None,None,Independent Study,,Philosophy,Instructor TBA,Senior,80-495
